,annotation_id,policy_id,segment_id,data_practice,label,selected_text,content_json,start,end
128,6837,3723,16,First Party Collection/Use,0,"If you use, purchase, or register for an Online Service through a third-party service such as a gaming console's network service, an internet based gaming service, or a social network website, or request that we associate a Company account with a third-party service account, then limited user account personal information may be transferred to the Company as part of the registration process and we may be able to collect information about your use of the Online Services. For example, if you purchase virtual currency through a gaming console service, that gaming console service will provide us with information to effectuate the transaction, including the amount of virtual currency purchased and a means to identify your Online Service accou","{""Collection Mode"": {""endIndexInSegment"": -1, ""startIndexInSegment"": -1, ""value"": ""Unspecified""}, ""Choice Scope"": {""endIndexInSegment"": -1, ""startIndexInSegment"": -1, ""value"": ""Unspecified""}, ""Action First-Party"": {""endIndexInSegment"": 746, ""startIndexInSegment"": 0, ""selectedText"": ""If you use, purchase, or register for an Online Service through a third-party service such as a gaming console's network service, an internet based gaming service, or a social network website, or request that we associate a Company account with a third-party service account, then limited user account personal information may be transferred to the Company as part of the registration process and we may be able to collect information about your use of the Online Services. For example, if you purchase virtual currency through a gaming console service, that gaming console service will provide us with information to effectuate the transaction, including the amount of virtual currency purchased and a means to identify your Online Service accou"", ""value"": ""Receive from other service/third-party (unnamed)""}, ""Personal Information Type"": {""endIndexInSegment"": 322, ""startIndexInSegment"": 302, ""selectedText"": ""personal information"", ""value"": ""Generic personal information""}, ""Choice Type"": {""endIndexInSegment"": -1, ""startIndexInSegment"": -1, ""value"": ""Unspecified""}, ""Identifiability"": {""endIndexInSegment"": -1, ""startIndexInSegment"": -1, ""value"": ""Unspecified""}, ""Does/Does Not"": {""endIndexInSegment"": -1, ""startIndexInSegment"": -1, ""value"": ""Does""}, ""User Type"": {""endIndexInSegment"": -1, ""startIndexInSegment"": -1, ""value"": ""Unspecified""}, ""Purpose"": {""endIndexInSegment"": 275, ""startIndexInSegment"": 1, ""selectedText"": ""f you use, purchase, or register for an Online Service through a third-party service such as a gaming console's network service, an internet based gaming service, or a social network website, or request that we associate a Company account with a third-party service account,"", ""value"": ""Additional service/feature""}}",0,746
129,4983,3723,17,First Party Collection/Use,0,access,"{""Collection Mode"": {""endIndexInSegment"": 87, ""startIndexInSegment"": 81, ""selectedText"": ""access"", ""value"": ""Implicit""}, ""Choice Scope"": {""endIndexInSegment"": -1, ""startIndexInSegment"": -1, ""value"": ""Unspecified""}, ""Action First-Party"": {""endIndexInSegment"": 55, ""startIndexInSegment"": 0, ""selectedText"": ""When you use an application on a Social Networking Site"", ""value"": ""Track user on other websites""}, ""Personal Information Type"": {""endIndexInSegment"": 61, ""startIndexInSegment"": 58, ""selectedText"": ""SNS"", ""value"": ""Social media data""}, ""Choice Type"": {""endIndexInSegment"": -1, ""startIndexInSegment"": -1, ""value"": ""Unspecified""}, ""Identifiability"": {""endIndexInSegment"": -1, ""startIndexInSegment"": -1, ""value"": ""Unspecified""}, ""Does/Does Not"": {""endIndexInSegment"": 87, ""startIndexInSegment"": 81, ""selectedText"": ""access"", ""value"": ""Does""}, ""User Type"": {""endIndexInSegment"": -1, ""startIndexInSegment"": -1, ""value"": ""Unspecified""}, ""Purpose"": {""endIndexInSegment"": -1, ""startIndexInSegment"": -1, ""value"": ""Unspecified""}}",81,87
130,4983,3723,17,First Party Collection/Use,0,When you use an application on a Social Networking Site,"{""Collection Mode"": {""endIndexInSegment"": 87, ""startIndexInSegment"": 81, ""selectedText"": ""access"", ""value"": ""Implicit""}, ""Choice Scope"": {""endIndexInSegment"": -1, ""startIndexInSegment"": -1, ""value"": ""Unspecified""}, ""Action First-Party"": {""endIndexInSegment"": 55, ""startIndexInSegment"": 0, ""selectedText"": ""When you use an application on a Social Networking Site"", ""value"": ""Track user on other websites""}, ""Personal Information Type"": {""endIndexInSegment"": 61, ""startIndexInSegment"": 58, ""selectedText"": ""SNS"", ""value"": ""Social media data""}, ""Choice Type"": {""endIndexInSegment"": -1, ""startIndexInSegment"": -1, ""value"": ""Unspecified""}, ""Identifiability"": {""endIndexInSegment"": -1, ""startIndexInSegment"": -1, ""value"": ""Unspecified""}, ""Does/Does Not"": {""endIndexInSegment"": 87, ""startIndexInSegment"": 81, ""selectedText"": ""access"", ""value"": ""Does""}, ""User Type"": {""endIndexInSegment"": -1, ""startIndexInSegment"": -1, ""value"": ""Unspecified""}, ""Purpose"": {""endIndexInSegment"": -1, ""startIndexInSegment"": -1, ""value"": ""Unspecified""}}",0,55
131,4983,3723,17,First Party Collection/Use,0,access,"{""Collection Mode"": {""endIndexInSegment"": 87, ""startIndexInSegment"": 81, ""selectedText"": ""access"", ""value"": ""Implicit""}, ""Choice Scope"": {""endIndexInSegment"": -1, ""startIndexInSegment"": -1, ""value"": ""Unspecified""}, ""Action First-Party"": {""endIndexInSegment"": 55, ""startIndexInSegment"": 0, ""selectedText"": ""When you use an application on a Social Networking Site"", ""value"": ""Track user on other websites""}, ""Personal Information Type"": {""endIndexInSegment"": 61, ""startIndexInSegment"": 58, ""selectedText"": ""SNS"", ""value"": ""Social media data""}, ""Choice Type"": {""endIndexInSegment"": -1, ""startIndexInSegment"": -1, ""value"": ""Unspecified""}, ""Identifiability"": {""endIndexInSegment"": -1, ""startIndexInSegment"": -1, ""value"": ""Unspecified""}, ""Does/Does Not"": {""endIndexInSegment"": 87, ""startIndexInSegment"": 81, ""selectedText"": ""access"", ""value"": ""Does""}, ""User Type"": {""endIndexInSegment"": -1, ""startIndexInSegment"": -1, ""value"": ""Unspecified""}, ""Purpose"": {""endIndexInSegment"": -1, ""startIndexInSegment"": -1, ""value"": ""Unspecified""}}",81,87
132,6073,3723,17,First Party Collection/Use,0,"When you use an application on a Social Networking Site (""SNS""), you allow us to access certain information from your profile from that SNS.","{""Collection Mode"": {""endIndexInSegment"": -1, ""startIndexInSegment"": -1, ""value"": ""Unspecified""}, ""Choice Scope"": {""endIndexInSegment"": -1, ""startIndexInSegment"": -1, ""value"": ""Unspecified""}, ""Action First-Party"": {""endIndexInSegment"": 140, ""startIndexInSegment"": 0, ""selectedText"": ""When you use an application on a Social Networking Site (\""SNS\""), you allow us to access certain information from your profile from that SNS."", ""value"": ""Receive from other service/third-party (unnamed)""}, ""Personal Information Type"": {""endIndexInSegment"": 125, ""startIndexInSegment"": 88, ""selectedText"": ""certain information from your profile"", ""value"": ""Social media data""}, ""Choice Type"": {""endIndexInSegment"": 241, ""startIndexInSegment"": 141, ""selectedText"": ""The information you allow us to access is affected by the privacy settings you establish at the SNS."", ""value"": ""Third-party privacy controls""}, ""Identifiability"": {""endIndexInSegment"": 125, ""startIndexInSegment"": 88, ""selectedText"": ""certain information from your profile"", ""value"": ""Identifiable""}, ""Does/Does Not"": {""endIndexInSegment"": 241, ""startIndexInSegment"": 0, ""selectedText"": ""When you use an application on a Social Networking Site (\""SNS\""), you allow us to access certain information from your profile from that SNS. The information you allow us to access is affected by the privacy settings you establish at the SNS."", ""value"": ""Does""}, ""User Type"": {""endIndexInSegment"": -1, ""startIndexInSegment"": -1, ""value"": ""Unspecified""}, ""Purpose"": {""endIndexInSegment"": 63, ""startIndexInSegment"": 0, ""selectedText"": ""When you use an application on a Social Networking Site (\""SNS\"")"", ""value"": ""Additional service/feature""}}",0,140
133,6073,3723,17,First Party Collection/Use,0,"When you use an application on a Social Networking Site (""SNS""), you allow us to access certain information from your profile from that SNS. The information you allow us to access is affected by the privacy settings you establish at the SNS.","{""Collection Mode"": {""endIndexInSegment"": -1, ""startIndexInSegment"": -1, ""value"": ""Unspecified""}, ""Choice Scope"": {""endIndexInSegment"": -1, ""startIndexInSegment"": -1, ""value"": ""Unspecified""}, ""Action First-Party"": {""endIndexInSegment"": 140, ""startIndexInSegment"": 0, ""selectedText"": ""When you use an application on a Social Networking Site (\""SNS\""), you allow us to access certain information from your profile from that SNS."", ""value"": ""Receive from other service/third-party (unnamed)""}, ""Personal Information Type"": {""endIndexInSegment"": 125, ""startIndexInSegment"": 88, ""selectedText"": ""certain information from your profile"", ""value"": ""Social media data""}, ""Choice Type"": {""endIndexInSegment"": 241, ""startIndexInSegment"": 141, ""selectedText"": ""The information you allow us to access is affected by the privacy settings you establish at the SNS."", ""value"": ""Third-party privacy controls""}, ""Identifiability"": {""endIndexInSegment"": 125, ""startIndexInSegment"": 88, ""selectedText"": ""certain information from your profile"", ""value"": ""Identifiable""}, ""Does/Does Not"": {""endIndexInSegment"": 241, ""startIndexInSegment"": 0, ""selectedText"": ""When you use an application on a Social Networking Site (\""SNS\""), you allow us to access certain information from your profile from that SNS. The information you allow us to access is affected by the privacy settings you establish at the SNS."", ""value"": ""Does""}, ""User Type"": {""endIndexInSegment"": -1, ""startIndexInSegment"": -1, ""value"": ""Unspecified""}, ""Purpose"": {""endIndexInSegment"": 63, ""startIndexInSegment"": 0, ""selectedText"": ""When you use an application on a Social Networking Site (\""SNS\"")"", ""value"": ""Additional service/feature""}}",0,241
134,6838,3723,17,First Party Collection/Use,0,you allow us to access certain information from your profile from that SNS.,"{""Collection Mode"": {""endIndexInSegment"": -1, ""startIndexInSegment"": -1, ""value"": ""Unspecified""}, ""Choice Scope"": {""endIndexInSegment"": -1, ""startIndexInSegment"": -1, ""value"": ""Unspecified""}, ""Action First-Party"": {""endIndexInSegment"": 140, ""startIndexInSegment"": 65, ""selectedText"": ""you allow us to access certain information from your profile from that SNS."", ""value"": ""Receive from other service/third-party (unnamed)""}, ""Personal Information Type"": {""endIndexInSegment"": 706, ""startIndexInSegment"": 394, ""selectedText"": ""our \""basic information\"" you have shared with everyone on the SNS; your profile picture or its URL; your friends list, your user ID number, which is linked to publicly available information such as name and profile photo; or other information indicated as part of the \""Request for Permission\"" prompt from the SNS."", ""value"": ""Social media data""}, ""Choice Type"": {""endIndexInSegment"": 182, ""startIndexInSegment"": 152, ""selectedText"": ""tion you allow us to access is"", ""value"": ""Third-party privacy controls""}, ""Identifiability"": {""endIndexInSegment"": -1, ""startIndexInSegment"": -1, ""value"": ""Unspecified""}, ""Does/Does Not"": {""endIndexInSegment"": -1, ""startIndexInSegment"": -1, ""value"": ""Does""}, ""User Type"": {""endIndexInSegment"": -1, ""startIndexInSegment"": -1, ""value"": ""Unspecified""}, ""Purpose"": {""endIndexInSegment"": 55, ""startIndexInSegment"": 9, ""selectedText"": ""use an application on a Social Networking Site"", ""value"": ""Additional service/feature""}}",65,140
135,6839,3723,17,Data Retention,4,"Once your information is received from an SNS, that information is stored and used by us in accordance with this Privacy Policy.","{""Personal Information Type"": {""endIndexInSegment"": -1, ""startIndexInSegment"": -1, ""value"": ""Unspecified""}, ""Retention Period"": {""endIndexInSegment"": 960, ""startIndexInSegment"": 832, ""selectedText"": ""Once your information is received from an SNS, that information is stored and used by us in accordance with this Privacy Policy."", ""value"": ""Unspecified""}, ""Retention Purpose"": {""endIndexInSegment"": -1, ""startIndexInSegment"": -1, ""value"": ""Unspecified""}}",832,960
136,C4304,3723,18,First Party Collection/Use,0,ultisite IDs may also provide other information to us.,"{""Collection Mode"": {""endIndexInSegment"": -1, ""startIndexInSegment"": -1, ""value"": ""Unspecified""}, ""Choice Scope"": {""endIndexInSegment"": -1, ""startIndexInSegment"": -1, ""value"": ""Unspecified""}, ""Action First-Party"": {""endIndexInSegment"": 342, ""startIndexInSegment"": 288, ""selectedText"": ""ultisite IDs may also provide other information to us."", ""value"": ""Receive from other service/third-party (unnamed)""}, ""Personal Information Type"": {""endIndexInSegment"": -1, ""startIndexInSegment"": -1, ""value"": ""Unspecified""}, ""Choice Type"": {""endIndexInSegment"": -1, ""startIndexInSegment"": -1, ""value"": ""Unspecified""}, ""Identifiability"": {""endIndexInSegment"": -1, ""startIndexInSegment"": -1, ""value"": ""Unspecified""}, ""Does/Does Not"": {""endIndexInSegment"": -1, ""startIndexInSegment"": -1, ""value"": ""Does""}, ""User Type"": {""endIndexInSegment"": -1, ""startIndexInSegment"": -1, ""value"": ""Unspecified""}, ""Purpose"": {""endIndexInSegment"": 249, ""startIndexInSegment"": 117, ""selectedText"": ""authenticate your identity and provide you the option to share certain personal information with us to pre-populate our sign up form"", ""value"": ""Service Operation and Security""}}",288,342
137,6074,3723,18,First Party Collection/Use,0,provide you the option to share certain personal information with us,"{""Collection Mode"": {""endIndexInSegment"": 216, ""startIndexInSegment"": 148, ""selectedText"": ""provide you the option to share certain personal information with us"", ""value"": ""Explicit""}, ""Choice Scope"": {""endIndexInSegment"": -1, ""startIndexInSegment"": -1, ""value"": ""Unspecified""}, ""Action First-Party"": {""endIndexInSegment"": 216, ""startIndexInSegment"": 148, ""selectedText"": ""provide you the option to share certain personal information with us"", ""value"": ""Receive from other service/third-party (named)""}, ""Personal Information Type"": {""endIndexInSegment"": 208, ""startIndexInSegment"": 180, ""selectedText"": ""certain personal information"", ""value"": ""Generic personal information""}, ""Choice Type"": {""endIndexInSegment"": 285, ""startIndexInSegment"": 251, ""selectedText"": ""Depending on your account settings"", ""value"": ""Third-party privacy controls""}, ""Identifiability"": {""endIndexInSegment"": 143, ""startIndexInSegment"": 130, ""selectedText"": ""your identity"", ""value"": ""Identifiable""}, ""Does/Does Not"": {""endIndexInSegment"": 342, ""startIndexInSegment"": 0, ""selectedText"": ""When you use Facebook Connect, OpenID or another multisite ID to log in to an Online Service, those ID services will authenticate your identity and provide you the option to share certain personal information with us to pre-populate our sign up form. Depending on your account settings, multisite IDs may also provide other information to us."", ""value"": ""Does""}, ""User Type"": {""endIndexInSegment"": -1, ""startIndexInSegment"": -1, ""value"": ""Unspecified""}, ""Purpose"": {""endIndexInSegment"": 92, ""startIndexInSegment"": 0, ""selectedText"": ""When you use Facebook Connect, OpenID or another multisite ID to log in to an Online Service"", ""value"": ""Additional service/feature""}}",148,216
138,6074,3723,18,First Party Collection/Use,0,provide you the option to share certain personal information with us,"{""Collection Mode"": {""endIndexInSegment"": 216, ""startIndexInSegment"": 148, ""selectedText"": ""provide you the option to share certain personal information with us"", ""value"": ""Explicit""}, ""Choice Scope"": {""endIndexInSegment"": -1, ""startIndexInSegment"": -1, ""value"": ""Unspecified""}, ""Action First-Party"": {""endIndexInSegment"": 216, ""startIndexInSegment"": 148, ""selectedText"": ""provide you the option to share certain personal information with us"", ""value"": ""Receive from other service/third-party (named)""}, ""Personal Information Type"": {""endIndexInSegment"": 208, ""startIndexInSegment"": 180, ""selectedText"": ""certain personal information"", ""value"": ""Generic personal information""}, ""Choice Type"": {""endIndexInSegment"": 285, ""startIndexInSegment"": 251, ""selectedText"": ""Depending on your account settings"", ""value"": ""Third-party privacy controls""}, ""Identifiability"": {""endIndexInSegment"": 143, ""startIndexInSegment"": 130, ""selectedText"": ""your identity"", ""value"": ""Identifiable""}, ""Does/Does Not"": {""endIndexInSegment"": 342, ""startIndexInSegment"": 0, ""selectedText"": ""When you use Facebook Connect, OpenID or another multisite ID to log in to an Online Service, those ID services will authenticate your identity and provide you the option to share certain personal information with us to pre-populate our sign up form. Depending on your account settings, multisite IDs may also provide other information to us."", ""value"": ""Does""}, ""User Type"": {""endIndexInSegment"": -1, ""startIndexInSegment"": -1, ""value"": ""Unspecified""}, ""Purpose"": {""endIndexInSegment"": 92, ""startIndexInSegment"": 0, ""selectedText"": ""When you use Facebook Connect, OpenID or another multisite ID to log in to an Online Service"", ""value"": ""Additional service/feature""}}",148,216
139,6074,3723,18,First Party Collection/Use,0,"When you use Facebook Connect, OpenID or another multisite ID to log in to an Online Service, those ID services will authenticate your identity and provide you the option to share certain personal information with us to pre-populate our sign up form. Depending on your account settings, multisite IDs may also provide other information to us.","{""Collection Mode"": {""endIndexInSegment"": 216, ""startIndexInSegment"": 148, ""selectedText"": ""provide you the option to share certain personal information with us"", ""value"": ""Explicit""}, ""Choice Scope"": {""endIndexInSegment"": -1, ""startIndexInSegment"": -1, ""value"": ""Unspecified""}, ""Action First-Party"": {""endIndexInSegment"": 216, ""startIndexInSegment"": 148, ""selectedText"": ""provide you the option to share certain personal information with us"", ""value"": ""Receive from other service/third-party (named)""}, ""Personal Information Type"": {""endIndexInSegment"": 208, ""startIndexInSegment"": 180, ""selectedText"": ""certain personal information"", ""value"": ""Generic personal information""}, ""Choice Type"": {""endIndexInSegment"": 285, ""startIndexInSegment"": 251, ""selectedText"": ""Depending on your account settings"", ""value"": ""Third-party privacy controls""}, ""Identifiability"": {""endIndexInSegment"": 143, ""startIndexInSegment"": 130, ""selectedText"": ""your identity"", ""value"": ""Identifiable""}, ""Does/Does Not"": {""endIndexInSegment"": 342, ""startIndexInSegment"": 0, ""selectedText"": ""When you use Facebook Connect, OpenID or another multisite ID to log in to an Online Service, those ID services will authenticate your identity and provide you the option to share certain personal information with us to pre-populate our sign up form. Depending on your account settings, multisite IDs may also provide other information to us."", ""value"": ""Does""}, ""User Type"": {""endIndexInSegment"": -1, ""startIndexInSegment"": -1, ""value"": ""Unspecified""}, ""Purpose"": {""endIndexInSegment"": 92, ""startIndexInSegment"": 0, ""selectedText"": ""When you use Facebook Connect, OpenID or another multisite ID to log in to an Online Service"", ""value"": ""Additional service/feature""}}",0,342
140,6075,3723,18,First Party Collection/Use,0,information about your gameplay may be collected and transmitted to the Company,"{""Collection Mode"": {""endIndexInSegment"": 578, ""startIndexInSegment"": 499, ""selectedText"": ""information about your gameplay may be collected and transmitted to the Company"", ""value"": ""Implicit""}, ""Choice Scope"": {""endIndexInSegment"": -1, ""startIndexInSegment"": -1, ""value"": ""Unspecified""}, ""Action First-Party"": {""endIndexInSegment"": 578, ""startIndexInSegment"": 433, ""selectedText"": ""When you play certain software products published by the Company, information about your gameplay may be collected and transmitted to the Company"", ""value"": ""Collect on website""}, ""Personal Information Type"": {""endIndexInSegment"": 530, ""startIndexInSegment"": 499, ""selectedText"": ""information about your gameplay"", ""value"": ""User online activities""}, ""Choice Type"": {""endIndexInSegment"": -1, ""startIndexInSegment"": -1, ""value"": ""Unspecified""}, ""Identifiability"": {""endIndexInSegment"": -1, ""startIndexInSegment"": -1, ""value"": ""Unspecified""}, ""Does/Does Not"": {""endIndexInSegment"": 838, ""startIndexInSegment"": 433, ""selectedText"": ""When you play certain software products published by the Company, information about your gameplay may be collected and transmitted to the Company through network services or any other internet connection method used by the hardware on which you play such games (collectively and individually your \""Internet Connection\""). See \""What Gameplay Information Does the Company Collect?\"" below for further details."", ""value"": ""Does""}, ""User Type"": {""endIndexInSegment"": -1, ""startIndexInSegment"": -1, ""value"": ""Unspecified""}, ""Purpose"": {""endIndexInSegment"": -1, ""startIndexInSegment"": -1, ""value"": ""Unspecified""}}",499,578
141,6075,3723,18,First Party Collection/Use,0,"When you play certain software products published by the Company, information about your gameplay may be collected and transmitted to the Company","{""Collection Mode"": {""endIndexInSegment"": 578, ""startIndexInSegment"": 499, ""selectedText"": ""information about your gameplay may be collected and transmitted to the Company"", ""value"": ""Implicit""}, ""Choice Scope"": {""endIndexInSegment"": -1, ""startIndexInSegment"": -1, ""value"": ""Unspecified""}, ""Action First-Party"": {""endIndexInSegment"": 578, ""startIndexInSegment"": 433, ""selectedText"": ""When you play certain software products published by the Company, information about your gameplay may be collected and transmitted to the Company"", ""value"": ""Collect on website""}, ""Personal Information Type"": {""endIndexInSegment"": 530, ""startIndexInSegment"": 499, ""selectedText"": ""information about your gameplay"", ""value"": ""User online activities""}, ""Choice Type"": {""endIndexInSegment"": -1, ""startIndexInSegment"": -1, ""value"": ""Unspecified""}, ""Identifiability"": {""endIndexInSegment"": -1, ""startIndexInSegment"": -1, ""value"": ""Unspecified""}, ""Does/Does Not"": {""endIndexInSegment"": 838, ""startIndexInSegment"": 433, ""selectedText"": ""When you play certain software products published by the Company, information about your gameplay may be collected and transmitted to the Company through network services or any other internet connection method used by the hardware on which you play such games (collectively and individually your \""Internet Connection\""). See \""What Gameplay Information Does the Company Collect?\"" below for further details."", ""value"": ""Does""}, ""User Type"": {""endIndexInSegment"": -1, ""startIndexInSegment"": -1, ""value"": ""Unspecified""}, ""Purpose"": {""endIndexInSegment"": -1, ""startIndexInSegment"": -1, ""value"": ""Unspecified""}}",433,578
